{
  "$schema": "https://json-schema.org/draft/2020-12/schema",
  "title": "Atomic H2D reference bundle",
  "type": "object",
  "additionalProperties": true,
  "required": ["schema_version", "result", "coverage_complete", "source_sha256", "donor_identity", "matrix_keys", "visual", "dynamic", "artifacts"],
  "properties": {
    "schema_version": {"const": "2.0"},
    "result": {"const": "pass"},
    "coverage_complete": {"const": true},
    "source_sha256": {"type": "string", "pattern": "^[0-9a-f]{64}$"},
    "donor_identity": {"type": "string", "minLength": 1},
    "matrix_keys": {"type": "array", "minItems": 1, "uniqueItems": true, "items": {"type": "string"}},
    "visual": {"type": "object", "required": ["donor_identity"], "properties": {"donor_identity": {"type": "string"}}, "additionalProperties": true},
    "dynamic": {"type": "object", "required": ["donor_identity"], "properties": {"donor_identity": {"type": ["string", "null"]}}, "additionalProperties": true},
    "artifacts": {"type": "array", "minItems": 1, "items": {"type": "object", "required": ["path", "sha256"], "properties": {"path": {"type": "string"}, "sha256": {"type": "string", "pattern": "^[0-9a-f]{64}$"}}, "additionalProperties": true}}
  }
}
